{
  "uid": "msg.add-actor",
  "kind": "message",
  "name": "AddActorMessage",
  "aliases": ["wire:449"],
  "summary": "Introduce a remote actor into the client's world view.",
  "purpose": "Presence: without this family of messages peers cannot appear to each other.",
  "authority": "server",
  "lifecycle": {
    "created_when": ["peer enters observer AOI", "self after possession (as applicable)"],
    "if_absent": "other players invisible; multiplayer appears empty"
  },
  "wire": { "id": 449, "direction": "S2C", "transport": "rep" },
  "domain_types": ["ActorId", "Transform"],
  "fields": [],
  "relations": [
    { "op": "part_of", "to": "flow.presence" },
    { "op": "measured_on", "to": "atlas.presence-codecs" }
  ],
  "confidence": "bytes",
  "status": "verified",
  "evidence": [
    {
      "type": "atlas",
      "ref": "research/atlas/presence-codecs.json"
    }
  ],
  "build": "30fe6461f929ba44178376a72f0765dc5da28ccba20e5006a60a229babd74033",
  "owners": { "crate": "azoth-wire", "module": "presence" }
}
