{
  "uid": "endpoint.omni-credentials",
  "kind": "endpoint",
  "name": "OmniCredentials",
  "summary": "STS-shaped credentials for SigV4 game HTTPS.",
  "purpose": "HTTPS boot chain surface before REP.",
  "authority": "shared",
  "wire": {
    "direction": "Bidi",
    "transport": "http"
  },
  "relations": [
    {
      "op": "part_of",
      "to": "flow.world-entry"
    }
  ],
  "confidence": "semantics",
  "status": "implemented",
  "evidence": [
    {
      "type": "atlas",
      "ref": "research/atlas/endpoints.json#OmniCredentials"
    }
  ],
  "owners": {
    "crate": "regiond",
    "module": null
  }
}
