{
  "uid": "msg.update",
  "kind": "message",
  "name": "UpdateMsg",
  "aliases": ["wire:106"],
  "summary": "Length-prefixed update blob (max 512 bytes) used as a carrier for component codecs.",
  "purpose": "Compact update path distinct from polymorphic Replicate constructors.",
  "authority": "server",
  "lifecycle": {
    "updated_when": ["small component patches"],
    "if_absent": "fallback to larger replicate paths or missing patches"
  },
  "wire": { "id": 106, "direction": "S2C", "transport": "rep" },
  "fields": [],
  "relations": [
    { "op": "part_of", "to": "flow.presence" },
    { "op": "measured_on", "to": "atlas.presence-codecs" }
  ],
  "confidence": "bytes",
  "status": "verified",
  "evidence": [
    { "type": "atlas", "ref": "research/atlas/presence-codecs.json" }
  ],
  "build": "30fe6461f929ba44178376a72f0765dc5da28ccba20e5006a60a229babd74033",
  "owners": { "crate": "azoth-wire", "module": "presence" }
}
