{
  "uid": "msg.fragment-update",
  "kind": "message",
  "name": "FragmentUpdateMsg",
  "aliases": ["wire:422"],
  "summary": "Fixed layout: big-endian u64 then big-endian u32.",
  "purpose": "Identity half of a fragment update; often paired with UpdateMsg blob payload.",
  "authority": "server",
  "lifecycle": {
    "updated_when": ["partial record dirty"],
    "if_absent": "full records resent or state stuck"
  },
  "wire": { "id": 422, "direction": "S2C", "transport": "rep" },
  "fields": [
    { "name": "first", "offset": "0x00", "size": 8, "endian": "be", "note": "meaning unproven" },
    { "name": "second", "offset": "0x08", "size": 4, "endian": "be", "note": "meaning unproven" }
  ],
  "relations": [
    { "op": "part_of", "to": "flow.presence" },
    { "op": "measured_on", "to": "atlas.presence-codecs" },
    { "op": "produces", "to": "msg.update" }
  ],
  "confidence": "layout",
  "status": "implemented",
  "evidence": [
    { "type": "atlas", "ref": "research/atlas/presence-codecs.json#all_six_facets_located" },
    { "type": "doc", "ref": "server/crates/azoth-wire/src/presence.rs" }
  ],
  "build": "30fe6461f929ba44178376a72f0765dc5da28ccba20e5006a60a229babd74033",
  "owners": { "crate": "azoth-wire", "module": "presence" }
}
